{
  "protocol_version": 1,
  "job_id": "22222222-2222-4222-8222-222222222222",
  "capability": {
    "id": "document.summarize",
    "version": "1.0"
  },
  "provider": {
    "app_id": "document-summarizer",
    "instance_id": "11111111-1111-4111-8111-111111111111"
  },
  "status": "completed",
  "created_at": "2026-08-29T12:00:00Z",
  "updated_at": "2026-08-29T12:00:05Z",
  "input_artifacts": [
    {
      "artifact_id": "33333333-3333-4333-8333-333333333333",
      "media_type": "application/pdf",
      "byte_size": 1024,
      "sha256": "aaaaaaaaaaaaaaaaaaaaaaaaaaaaaaaaaaaaaaaaaaaaaaaaaaaaaaaaaaaaaaaa"
    }
  ],
  "result": {
    "outputs": [
      {
        "artifact_id": "44444444-4444-4444-8444-444444444444",
        "media_type": "application/vnd.local-connect.document-summary+json",
        "byte_size": 256,
        "sha256": "bbbbbbbbbbbbbbbbbbbbbbbbbbbbbbbbbbbbbbbbbbbbbbbbbbbbbbbbbbbbbbbb",
        "content": {
          "summary_version": "1.0",
          "text": "The report records exact source-grounded findings.",
          "warnings": [
            {
              "code": "SEMANTIC_VERIFICATION_DEFERRED",
              "message": "Semantic fact verification is deferred."
            }
          ],
          "input_artifact": {
            "artifact_id": "33333333-3333-4333-8333-333333333333",
            "media_type": "application/pdf",
            "byte_size": 1024,
            "sha256": "aaaaaaaaaaaaaaaaaaaaaaaaaaaaaaaaaaaaaaaaaaaaaaaaaaaaaaaaaaaaaaaa"
          }
        }
      }
    ]
  }
}
